{
  "published_at": "2026-10-12T12:49:18Z",
  "as_of": "2026-08-01",
  "items": [
    {
      "code": "APU0000704111",
      "name": "Avg price: bacon, sliced, lb",
      "month": "2026-08-01",
      "price": 6.605,
      "mom_pct": 0.32,
      "yoy_pct": -8.37,
      "series": {
        "months": [
          "2018-01-01",
          "2018-02-01",
          "2018-03-01",
          "2018-04-01",
          "2018-05-01",
          "2018-06-01",
          "2018-07-01",
          "2018-08-01",
          "2018-09-01",
          "2018-10-01",
          "2018-11-01",
          "2018-12-01",
          "2019-01-01",
          "2019-02-01",
          "2019-03-01",
          "2019-04-01",
          "2019-05-01",
          "2019-06-01",
          "2019-07-01",
          "2019-08-01",
          "2019-09-01",
          "2019-10-01",
          "2019-11-01",
          "2019-12-01",
          "2020-01-01",
          "2020-02-01",
          "2020-03-01",
          "2020-04-01",
          "2020-05-01",
          "2020-06-01",
          "2020-07-01",
          "2020-08-01",
          "2020-09-01",
          "2020-10-01",
          "2020-11-01",
          "2020-12-01",
          "2021-01-01",
          "2021-02-01",
          "2021-03-01",
          "2021-04-01",
          "2021-05-01",
          "2021-06-01",
          "2021-07-01",
          "2021-08-01",
          "2021-09-01",
          "2021-10-01",
          "2021-11-01",
          "2021-12-01",
          "2022-01-01",
          "2022-02-01",
          "2022-03-01",
          "2022-04-01",
          "2022-05-01",
          "2022-06-01",
          "2022-07-01",
          "2022-08-01",
          "2022-09-01",
          "2022-10-01",
          "2022-11-01",
          "2022-12-01",
          "2023-01-01",
          "2023-02-01",
          "2023-03-01",
          "2023-04-01",
          "2023-05-01",
          "2023-06-01",
          "2023-07-01",
          "2023-08-01",
          "2023-09-01",
          "2023-10-01",
          "2023-11-01",
          "2023-12-01",
          "2024-01-01",
          "2024-02-01",
          "2024-03-01",
          "2024-04-01",
          "2024-05-01",
          "2024-06-01",
          "2024-07-01",
          "2024-08-01",
          "2024-09-01",
          "2024-10-01",
          "2024-11-01",
          "2024-12-01",
          "2025-01-01",
          "2025-02-01",
          "2025-03-01",
          "2025-04-01",
          "2025-05-01",
          "2025-06-01",
          "2025-07-01",
          "2025-08-01",
          "2025-09-01",
          "2025-11-01",
          "2025-12-01",
          "2026-01-01",
          "2026-02-01",
          "2026-03-01",
          "2026-04-01",
          "2026-05-01",
          "2026-06-01",
          "2026-07-01",
          "2026-08-01"
        ],
        "prices": [
          5.654,
          5.533,
          5.527,
          5.421,
          5.452,
          5.247,
          5.418,
          5.577,
          5.501,
          5.37,
          5.392,
          5.502,
          5.518,
          5.502,
          5.608,
          5.552,
          5.812,
          5.878,
          5.701,
          5.576,
          5.571,
          5.653,
          5.505,
          5.474,
          5.505,
          5.497,
          5.257,
          5.346,
          5.348,
          5.772,
          5.776,
          5.559,
          5.619,
          5.722,
          5.754,
          5.831,
          5.831,
          5.778,
          5.852,
          6.215,
          6.346,
          6.67,
          6.857,
          7.096,
          7.22,
          7.317,
          7.265,
          7.211,
          7.222,
          7.097,
          7.203,
          7.422,
          7.364,
          7.403,
          7.415,
          7.372,
          7.383,
          7.608,
          7.243,
          6.956,
          6.808,
          6.595,
          6.613,
          6.549,
          6.339,
          6.224,
          6.236,
          6.502,
          7.083,
          7.223,
          6.899,
          6.774,
          6.614,
          6.56,
          6.609,
          6.637,
          6.818,
          6.827,
          6.883,
          6.785,
          6.955,
          6.869,
          6.843,
          6.915,
          7.044,
          6.798,
          6.978,
          7.009,
          6.985,
          7.098,
          7.118,
          7.208,
          7.29,
          6.928,
          6.76,
          6.978,
          6.904,
          6.801,
          6.826,
          6.712,
          6.561,
          6.584,
          6.605
        ]
      }
    },
    {
      "code": "APU0000711211",
      "name": "Avg price: bananas, lb",
      "month": "2026-08-01",
      "price": 0.652,
      "mom_pct": 0.31,
      "yoy_pct": -2.1,
      "series": {
        "months": [
          "2018-01-01",
          "2018-02-01",
          "2018-03-01",
          "2018-04-01",
          "2018-05-01",
          "2018-06-01",
          "2018-07-01",
          "2018-08-01",
          "2018-09-01",
          "2018-10-01",
          "2018-11-01",
          "2018-12-01",
          "2019-01-01",
          "2019-02-01",
          "2019-03-01",
          "2019-04-01",
          "2019-05-01",
          "2019-06-01",
          "2019-07-01",
          "2019-08-01",
          "2019-09-01",
          "2019-10-01",
          "2019-11-01",
          "2019-12-01",
          "2020-01-01",
          "2020-02-01",
          "2020-03-01",
          "2020-04-01",
          "2020-05-01",
          "2020-06-01",
          "2020-07-01",
          "2020-08-01",
          "2020-09-01",
          "2020-10-01",
          "2020-11-01",
          "2020-12-01",
          "2021-01-01",
          "2021-02-01",
          "2021-03-01",
          "2021-04-01",
          "2021-05-01",
          "2021-06-01",
          "2021-07-01",
          "2021-08-01",
          "2021-09-01",
          "2021-10-01",
          "2021-11-01",
          "2021-12-01",
          "2022-01-01",
          "2022-02-01",
          "2022-03-01",
          "2022-04-01",
          "2022-05-01",
          "2022-06-01",
          "2022-07-01",
          "2022-08-01",
          "2022-09-01",
          "2022-10-01",
          "2022-11-01",
          "2022-12-01",
          "2023-01-01",
          "2023-02-01",
          "2023-03-01",
          "2023-04-01",
          "2023-05-01",
          "2023-06-01",
          "2023-07-01",
          "2023-08-01",
          "2023-09-01",
          "2023-10-01",
          "2023-11-01",
          "2023-12-01",
          "2024-01-01",
          "2024-02-01",
          "2024-03-01",
          "2024-04-01",
          "2024-05-01",
          "2024-06-01",
          "2024-07-01",
          "2024-08-01",
          "2024-09-01",
          "2024-10-01",
          "2024-11-01",
          "2024-12-01",
          "2025-01-01",
          "2025-02-01",
          "2025-03-01",
          "2025-04-01",
          "2025-05-01",
          "2025-06-01",
          "2025-07-01",
          "2025-08-01",
          "2025-09-01",
          "2025-11-01",
          "2025-12-01",
          "2026-01-01",
          "2026-02-01",
          "2026-03-01",
          "2026-04-01",
          "2026-05-01",
          "2026-06-01",
          "2026-07-01",
          "2026-08-01"
        ],
        "prices": [
          0.568,
          0.574,
          0.582,
          0.578,
          0.575,
          0.575,
          0.575,
          0.569,
          0.573,
          0.574,
          0.566,
          0.577,
          0.576,
          0.571,
          0.581,
          0.567,
          0.579,
          0.574,
          0.569,
          0.578,
          0.569,
          0.573,
          0.573,
          0.573,
          0.57,
          0.574,
          0.576,
          0.581,
          0.589,
          0.588,
          0.58,
          0.576,
          0.574,
          0.577,
          0.578,
          0.572,
          0.597,
          0.59,
          0.594,
          0.604,
          0.6,
          0.595,
          0.594,
          0.589,
          0.597,
          0.6,
          0.619,
          0.622,
          0.63,
          0.628,
          0.642,
          0.637,
          0.642,
          0.64,
          0.64,
          0.643,
          0.643,
          0.634,
          0.631,
          0.628,
          0.639,
          0.641,
          0.632,
          0.635,
          0.628,
          0.625,
          0.631,
          0.631,
          0.625,
          0.626,
          0.627,
          0.625,
          0.617,
          0.625,
          0.629,
          0.626,
          0.622,
          0.625,
          0.613,
          0.612,
          0.617,
          0.619,
          0.622,
          0.615,
          0.621,
          0.619,
          0.625,
          0.635,
          0.655,
          0.654,
          0.657,
          0.666,
          0.67,
          0.664,
          0.656,
          0.653,
          0.653,
          0.657,
          0.654,
          0.646,
          0.645,
          0.65,
          0.652
        ]
      }
    },
    {
      "code": "APU0000702111",
      "name": "Avg price: bread, white, lb",
      "month": "2026-08-01",
      "price": 1.823,
      "mom_pct": 0.16,
      "yoy_pct": -0.98,
      "series": {
        "months": [
          "2018-01-01",
          "2018-02-01",
          "2018-03-01",
          "2018-04-01",
          "2018-05-01",
          "2018-06-01",
          "2018-07-01",
          "2018-08-01",
          "2018-09-01",
          "2018-10-01",
          "2018-11-01",
          "2018-12-01",
          "2019-01-01",
          "2019-02-01",
          "2019-03-01",
          "2019-04-01",
          "2019-05-01",
          "2019-06-01",
          "2019-07-01",
          "2019-08-01",
          "2019-09-01",
          "2019-10-01",
          "2019-11-01",
          "2019-12-01",
          "2020-01-01",
          "2020-02-01",
          "2020-03-01",
          "2020-04-01",
          "2020-05-01",
          "2020-06-01",